{
  "name": "Example Title",
  "display_name": "example_value",
  "version": "example_value",
  "delegate_descriptor_id": "500123",
  "settings": "example_value",
  "enabled": true,
  "published": true,
  "dirty": true,
  "revision_number": 10,
  "deleted_at": "2026-01-15T10:30:00Z",
  "created_at": "2026-01-15T10:30:00Z",
  "updated_at": "2026-01-15T10:30:00Z"
}